{
  "schema_version": 1,
  "kind": "fd2_string_inventory_summary",
  "locale": "zh-Hant",
  "status": "diagnostic",
  "generated_by": {
    "tool": "fd2-string-inventory",
    "version": "1"
  },
  "inventory_sha256": "bba089ef90272e287c20260b037d3a26805aae7effc1a71fe4ee2ef1d6dd4ac3",
  "entry_count": 5169,
  "unique_text_count": 2457,
  "variable_entry_count": 120,
  "by_id_status": {
    "provisional_legacy_path": 4690,
    "provisional_source_location": 479
  },
  "by_role": {
    "chapter_title": 37,
    "character_name": 1563,
    "command_or_ui": 38,
    "dialogue": 1563,
    "dialogue_or_system": 139,
    "entity_name": 989,
    "go_review": 98,
    "location_name": 58,
    "option_or_ui": 140,
    "prompt": 30,
    "runtime_ui": 379,
    "scene_label": 135
  },
  "by_role_unique_text": {
    "chapter_title": 37,
    "character_name": 115,
    "command_or_ui": 38,
    "dialogue": 1476,
    "dialogue_or_system": 83,
    "entity_name": 211,
    "go_review": 93,
    "location_name": 58,
    "option_or_ui": 8,
    "prompt": 3,
    "runtime_ui": 274,
    "scene_label": 131
  },
  "by_confidence": {
    "direct_ui_context": 379,
    "field_rule": 4690,
    "function_context": 2,
    "non_ascii_production_literal": 98
  }
}
